### ISSUE TITLE
Android: traffic from some apps never enters the tunnel (Chrome works, Termux/OkHttp apps time out)

### ISSUE THREAD

**Issue by luii** [netbirdio/android-client#220]
debug bundle: `bc621460a782af685c820147ab5d624516463791d7fa53d2e34e9adb181c930d/d3666556-a3ab-456f-b0a2-a586e9c18258`

## Summary

On an Android peer, TCP connections to another NetBird peer succeed from Chrome
but time out from other apps (Termux `curl`, Bitwarden). A packet capture taken
**on the destination peer** shows Chrome's connection arriving and completing
normally, while the failing apps produce **zero packets** — no SYN, no
retransmit, nothing. The packets never reach the destination peer at all.

DNS resolves correctly in every app. The failure is at TCP connect, and it is
silent: no error on the client beyond a 10 s timeout, and nothing at all on the
server.

## Environment
| Name | Version |
|---|---|
| Management | v0.74.7 |
| Dashboard | v2.90.4 |
| Android client | 0.5.0 |
| Android device | Pixel 7a, Android 17 |
| Destination peer | Linux (Docker), NetBird client `netbirdio/netbird:latest` (as sidecar) |
| IPv6 | **Disabled** in the Android client's advanced settings |
| Deployment | Self-hosted |

## Setup

- Android phone is a peer: `100.102.141.70`
- Destination is a peer running in a Docker container: `100.102.188.247`,
  serving HTTPS on TCP 443 (Caddy)
- Access policy permits **TCP 443** from the phone's group to the destination
  group, unidirectional
- Hostname resolves via a **Custom DNS Zone** A record →`100.102.188.247`
- A Linux desktop peer (`100.102.149.31`) reaches the same destination without
  any problem

## Symptom

Same phone, same destination IP and port, within minutes of each other:

| Client | Result |
|---|---|
| Chrome (Android) | ✅ Full HTTPS, ~30 KB transferred |
| Termux `curl -4` | ❌ TCP connect timeout after 10 s |
| Termux `curl` (default) | ❌ TCP connect timeout after 10 s |
| Bitwarden Android app 2026.6.1 | ❌ `java.net.SocketTimeoutException` |

DNS resolution succeeds in all of them and returns the correct address.

### Client-side error (Bitwarden)

```
java.net.SocketTimeoutException: failed to connect to
vault.example.com/100.102.188.247 (port 443) from /100.102.141.70 (port 40916)
after 10000ms
    libcore.io.IoBridge.connectErrno(IoBridge.java:235)
    libcore.io.IoBridge.connect(IoBridge.java:179)
    java.net.PlainSocketImpl.socketConnect(PlainSocketImpl.java:142)
    ...
```

Note the source address is reported as the NetBird address `100.102.141.70`.

## Server-side evidence

`tcpdump` run inside the destination peer's network namespace, capturing while
Chrome loaded the page and the failing apps were retried.

**Chrome's connection — arrives and completes normally:**

```
10:20:15.634647 wt0 In  100.102.141.70.54628 > 100.102.188.247.443: Flags [S], seq 716077464, win 65535, options [mss 1240,sackOK,TS...]
10:20:15.634788 wt0 Out 100.102.188.247.443 > 100.102.141.70.54628: Flags [S.], seq 663717827, ack 716077465, win 65084, options [mss 1240,...]
10:20:15.686295 wt0 In  100.102.141.70.54628 > 100.102.188.247.443: Flags [.], ack 1, win 256
10:20:15.686629 wt0 In  100.102.141.70.54628 > 100.102.188.247.443: Flags [P.], seq 1:1804, ack 1, length 1803      <- TLS ClientHello
10:20:15.691075 wt0 Out 100.102.188.247.443 > 100.102.141.70.54628: Flags [P.], seq 1:2457, ack 1804, length 2456
...  ~30 KB transferred, all segments ACKed, no retransmissions ...
10:20:40.910284 wt0 In  100.102.141.70.54628 > 100.102.188.247.443: Flags [R.], seq 2874, ack 29808                 <- client resets after idle
```

**The failing apps — nothing.** Across 362 captured packets, that is the *only*
connection from `100.102.141.70`. The Termux and Bitwarden attempts produced no
SYN, no retransmission, and no packet of any kind at the destination.

Correspondingly, the reverse proxy's access log shows requests from the phone
for Chrome only. Nothing from the other clients ever reaches it.

**Isolated confirmation.** A second capture was taken with the same filter
(`tcp port 443`) while running *only* the Termux `curl` on the phone — no
browser activity. 63 packets captured over ~14 s, and **not a single one from
`100.102.141.70`**. Every `wt0` frame belonged to an unrelated Linux peer
(`100.102.149.31`). The curl timed out client-side as usual.

This isolates the behaviour: the failing app's packets are not merely dropped
somewhere in the path, they never arrive at the destination peer at all.

## What this rules out

- **DNS** — resolution succeeds in every app and returns the correct address
- **Access policy / ACL** — the same peer, port and protocol succeed from Chrome
- **MTU** — MSS 1240 negotiated, ~30 KB transferred with no retransmissions
- **IPv6 / Happy Eyeballs** — IPv6 is disabled in the client, and `curl -4`
  fails identically
- **Anything server-side** — the packets never arrive; the destination cannot
  drop what it never receives
- **Private DNS** — resolution works
- **Battery optimisation / Data Saver** — Bitwarden is set to unrestricted

## Additional observation: "Block connections without VPN"

Enabling Android's **Block connections without VPN** for the NetBird profile
breaks DNS resolution entirely on this device — no name resolves at all, for
any app. Disabling it restores resolution, and the app-specific TCP failure
described above returns.

That setting drops any traffic not traversing the tunnel, so this suggests a
share of the device's traffic is not being captured by the `VpnService` and was
only working because it could route around it. This is consistent with the
capture evidence, though it does not by itself explain why DNS is affected when
the client is expected to supply the resolver.

Possibly related: netbirdio/android-client#206 (Always-on VPN / Block
connections without VPN breaking networking on Android 17).

## Expected behaviour

All apps' traffic to a NetBird peer address should be routed into the tunnel.

## Actual behaviour

Only some apps' traffic enters the tunnel. Others' packets are silently
discarded before reaching the destination peer — consistent with them being
sent over the physical interface, where a `100.64.0.0/10` address is
unroutable and dropped without an error.

## Notes

`IFace.java` calls `addDisallowedApplication` for four hardcoded packages
(Android Auto, Chromecast, Google Messages, Stadia) and never calls
`addAllowedApplication`. Neither Termux nor Bitwarden is in that list, and
per-app split tunnelling is an open, unimplemented request
(netbirdio/android-client#72), so this does not appear to be intentional
exclusion.

## Reproduction

1. Self-hosted NetBird; Android peer and a Linux peer running an HTTPS service
2. Policy allowing TCP 443 from the Android peer's group to the service's group
3. Custom DNS Zone A record for the service → its peer IP
4. From Chrome on the phone, load the URL — succeeds
5. From Termux on the same phone, `curl -4 -sv --max-time 10 https://<url>` —
   times out at TCP connect
6. Capture on the destination peer to confirm only Chrome's packets arrive

## Already tried, did not help

- Reinstalling the Android client
- Rebooting the phone
- Force-stopping the affected apps
- Disabling IPv6 in the client
- Setting the affected app to unrestricted battery/data usage

## Not yet tried

- Testing on a second Android device
- Capturing on the phone (requires root)

## Personal Notes

Maybe its a Skill Issue from my side, but im at the end of my knowledge and i do think that not receiving anything on the peers side could maybe hint at a possible problem. I'm more than happy to provide more Information if that is needed! Just let me know!

**Comment by luii** [comment]
# Follow-up

## single capture window, DNS eliminated, peer re-registered

A later capture was taken in **one window**, after re-logging in on the Android
client (which assigned a new peer address, `100.102.121.214`), filtered to that
peer only:

```
tcpdump -ni wt0 'host 100.102.121.214'
```

Clients exercised in this order, all within ~2 minutes:

| Client | Target | Packets at destination |
|---|---|---|
| Termux `curl` | hostname | **none** |
| Chrome | hostname | 2 connections, full TLS, ~26 KB + ~5 KB, clean FIN close |
| Bitwarden | hostname | **none** |
| Termux `curl -k https://100.102.188.247` | **raw IP, no DNS** | **none** |

The raw-IP test removes name resolution from the path entirely and still
produces zero packets, while Chrome reaches the same address in the same
window. Re-registration with a fresh peer address did not change the behaviour.

Minimal statement of the bug: **TCP connections to a peer address succeed from
one app and produce no packets at all from another, on the same device, at the
same time, with DNS excluded.**

## Android routing is verifiably identical for working and failing apps

Checked on-device with `adb` (no root). This rules out the kernel/VpnService
layer entirely.

**VPN network UID scope** (`dumpsys connectivity`, netId 122, `VPN:io.netbird.client`):

```
Uids: <{0-10108, 10110-10136, 10138-20108, 20110-20136, 20138-99999}>
```

The four gaps (`10109`, `10137`, `20109`, `20137`) correspond exactly to the
four `addDisallowedApplication` calls in `IFace.java`. `10137` is confirmed in
the dump as `com.google.android.apps.messaging`.

**App UIDs** (`pm list packages -U`):

| App | UID | In VPN uidrange | Result |
|---|---|---|---|
| `com.android.chrome` | 10180 | yes (10138–20108) | **works** |
| `com.termux` | 10361 | yes (10138–20108) | fails |
| `com.x8bit.bitwarden` | 10423 | yes (10138–20108) | fails |

**Routes installed on the tun** (`dumpsys connectivity` + `ip route show table all`):

```
Routes: [ 100::/64 -> :: tun0, 240.0.0.0/8 -> 0.0.0.0 tun0, 100.102.0.0/16 -> 0.0.0.0 tun0 ]
100.102.0.0/16 dev tun0 table 1065 proto static scope link
```

The destination `100.102.188.247` is inside `100.102.0.0/16`, routed to `tun0`
via table 1065.

**Policy rules** (`ip rule show`): the implicit-routing rules at priority 13000
(`fwmark 0x0/0x20000`) send all in-scope UIDs to table 1065. The VPN-bypass
rules at 15040/22040/25000/29040 (to table 1046, WiFi) cover only
`10112, 10137, 10149, 10160, 10168, 10174, 10249, 10259` — none of the three
apps above.

**Conclusion:** the kernel places packets from all three apps into `tun0`
identically. There is no routing-layer difference between the app that works
and the two that do not.

> **Correction.** An earlier revision of this report concluded here that "the
> packets enter the tun and are not transmitted by the client." That is **wrong**
> and is retracted. The interface counter measurements below show the packets
> never reach the tun device at all, so the NetBird client never receives them.

## Client trace log: the app's DNS reaches the engine, its TCP does not

Captured with `adb logcat` at trace log level, one window, Chrome first then
`curl`. Destination peer is `100.102.188.247` (`vault-service`).

**Peer is configured correctly:**

```
17:18:22.821 [DEBG] client/iface/iface.go:161 updating interface tun0
  peer 4PAlafoIFww9…, endpoint 127.1.188.247:51820, allowedIPs [100.102.188.247/32]
```

AllowedIPs contain the destination, so a wireguard-go "no peer has allowed IPs"
drop is **not** occurring.

**Chrome — engine sees and handles both connections:**

```
17:18:29.574  DNS vault.internal.foad.wtf (A+AAAA+HTTPS) → 100.102.188.247
17:18:30.338  New egress TCP connection: 100.102.121.214:37864 → 100.102.188.247:443
              New → SYN Sent → Established → … completed [in: 10 Pkts/5793 B]
17:18:32.339  New egress TCP connection: 100.102.121.214:37866 → 100.102.188.247:443
              New → SYN Sent → Established
17:18:42.340  connection reset [in: 36 Pkts/29405 B, out: 28 Pkts/4616 B]
```

**curl — DNS handled, TCP never appears:**

```
17:18:52.817  DNS vault.internal.foad.wtf (A only) → 100.102.188.247
              rcode=NOERROR answers=[100.102.188.247] took=431.844µs
              …no `New egress TCP connection` entry, ever.
```

The log runs to 17:19:09 — 17 seconds past that DNS answer, more than the 10 s
connect timeout. `grep` over the whole capture finds exactly **two** egress TCP
connections, both Chrome's.

**This is the crux:** from the same application, the **UDP DNS query to
`100.102.255.254` is read from the tun and answered by the engine**, while the
**TCP SYN to `100.102.188.247` never appears in the engine's flow tracking at
all**. Both destinations are inside `100.102.0.0/16`, both routed via `tun0` by
the same policy rule. The engine is demonstrably reading the tun at that moment.

## Decisive measurement: the SYN never reaches the tun device

All three observations below come from a **single capture window**, one `curl`
from Termux, phone otherwise untouched.

Monitors (both via `adb shell`, no root):

```bash
while true; do date +%T; grep tun0 /proc/net/dev; sleep 1; done
while true; do date +%T; grep -i "F7BC6664:01BB" /proc/net/tcp; sleep 1; done
```

(`F7BC6664:01BB` = `100.102.188.247:443` in `/proc/net/tcp` byte order.)

```
18:12:05–:21   tun0 tx_packets = 313      flat, 16 s baseline
18:12:22       tun0 tx_packets = 316      +3 out / +3 in  (DNS, balanced)
18:12:22       socket: 100.102.121.214:58294 → 100.102.188.247:443
               st=02 (SYN_SENT)  retrnsmt=0  RTO=100  uid=10361
18:12:23       retrnsmt=1  RTO=200
18:12:25       retrnsmt=2  RTO=400
18:12:29       retrnsmt=3  RTO=800
18:12:34       socket gone (curl 12 s timeout)
18:12:22–:43   tun0 tx_packets = 316      flat, unchanged, 21 s
```

Three facts, same clock:

1. **The kernel routed the connection to `tun0`.** Source-address selection
   stamped the socket with `100.102.121.214`, the tun0 address. That is the
   kernel reporting its own route decision for this specific socket.
2. **The kernel emitted four SYN segments** with textbook exponential backoff.
3. **`tun0` transmitted nothing** across any of them.

The `+3/+3` at :22 is DNS — equal counts in both directions. Had a SYN been
transmitted, tx would exceed rx by one. It does not. The three retransmissions
after :22 stand alone regardless.

### UDP from the same UID does cross the tun

```
18:23:05–:21   tun0 tx = 360   flat baseline
18:23:23       tun0 tx = 361   +1 out (81 B) / +1 in (81 B)
```

`dig @100.102.149.31` from Termux — a **real peer address**, not the virtual
DNS address — moves the counter. So the discriminator is not "virtual vs. real
peer": it is the protocol. Same UID, same interface, same peer network:

| From UID 10361 → real peer | tun0 tx |
|---|---|
| UDP/53 | **+1, transmitted** |
| TCP/443, TCP/8000 | nothing, across 4 retransmits |

### Interpretation

On a tun device, `tx_packets` increments when userspace reads the packet
(`tun_put_user`). The read loop was demonstrably alive throughout — DNS packets
were read in both windows above. A queued SYN would therefore also have been
read. It was not, so it was never queued: the packet is discarded between the
route decision and the device, i.e. in the egress filtering path, before the
`VpnService` file descriptor.

**The NetBird client cannot be the cause of the drop, because it never receives
the packet.** This report is filed on the possibility that something in the
client's `VpnService` configuration provokes the platform into this behaviour;
the drop itself is below the client.

## Version skew eliminated

The released APK **v0.5.0** (2026-05-15, latest) pins the `netbird` submodule at
commit `07e5450`, which is exactly **v0.71.0** — 179 commits behind a v0.74.7
management server. `main` pins v0.74.2.

To rule this out, the client was **built from source with the submodule pinned to
v0.74.7**, matching the management server exactly, and installed via `adb`:

```
git clone --recurse-submodules https://github.com/netbirdio/android-client.git
cd android-client/netbird && git checkout v0.74.7 && cd ..
./build-android-lib.sh v0.74.7
./gradlew assembleDebug -PversionCode=999 -PversionName=0.74.7-local
```

App reports version `0.74.7-local`. **The behaviour is unchanged** — TCP from
the affected UIDs still produces no tun0 transmit.

Separately: the latest published APK shipping a core 179 commits behind current
may be worth addressing on its own.

**Comment by luii** [comment]
## Update

### **TLDR**:
Everything i tried doesnt work, bitwardens app tries to resolve the public ip in "vpn always on" mode and refuses to resolve a hostname through the netbird network in "block all other connections besides vpn" mode.
**Solution**: Switch to Passbolt 

### Longer Explanation:  
In the meantime, i switched to using `Passbolt` as my main Password-Vault, it runs in a docker compose stack with a netbird client sidecar. Without any porblems it was setup and worked right out of the Box, almost all Passwords from my Vaultwarden Vault can be imported, but i think this is a small price to pay. A couple of Years ago i had a similiar setup that was much more bare bones with `wg-easy` and a split-brain dns (i believe it was `dnsmasq`) and i had the same problems if i can remember. 

Having the same "problem" with a different stack, not being able to login from the bitwarden app, shifts the suspicion of to the Bitwarden Android App (dont know if iOS's App also has this problem though). Debugging the Public repo of the App, revealed that the Bitwarden App specifies some [Capabilities](https://github.com/bitwarden/android/blob/main/app/src/main/kotlin/com/x8bit/bitwarden/data/platform/manager/network/NetworkConnectionManagerImpl.kt) under which the `VPN` Capabilities are missing and or only Internet Capabilities (Cellular/Wifi) are imported.
I dont know if #72 (Split Tunneling) will fix this, forcing the app to ignore these capabilities, im not an android developer after all.

Weirdly enough if i'd forced the (netbird) vpn to be always on, i will receive a 403 Error on the Bitwarden App, the error is expected to be received, when you put the service into a **"Netbird-only"** Proxy Service (`NB_PROXY_PRIVATE=true`) and not connect to said netbird network first. Basically, from the Outside of the Network -> 403; from the inside -> normal resolution of the service (on pc, browser extension and web vaults and expectedly from the app). 
It got even weirder when i turned on the "Only allow VPN connections" (may be differently named for you, but its to block out any other connection besides vpn), there were practically no more dns resolutions from the vpn network. Remember, everything else worked like a charm on my smartphone: **web-vault**, **browser-extension** for **chrome/FF**. Trying to login into the App now would result in a `hostname not found`, stating it could not resolve this FQDN to a valid IP Address. Which, in my understanding translates to: "this (Bitwarden) App doesnt use the advertised DNS Server from Netbird to resolve ips".

I honestly dont know if this is a problem with the configuration of netbird, and/or of the bitwarden app. Maybe the Devs of the Android Netbird Client can say more to that? Until then i close this issue with the reason of being "resolved".
